Sheet: Findings
A1: System Requirement (Functional & NonFunctional Requirements) | B1: N/F
A2: Search Book Title | B2: F
A3: Reserve Book | B3: F
A4: Checkout Book | B4: F
A5: Checkin Book | B5: F
A6: Add New Book | B6: F
A7: Report Book Titles | B7: F
A8: View Overdue Books | B8: F
A9: Delete Book | B9: F
A10: View Reservations | B10: F
A11: Update Book Information | B11: F
A12: Update Patron Information | B12: F
A13: Update Reservation | B13: F
A14: Print Loaned Book Report | B14: F
A15: Remove Book From Library | B15: F
A16: View Patron | B16: F
A17: Remove Old Loans | B17: F
A18: Remove Old Reservation | B18: F
A19: Use Patrons from Student System | B19: N
A20: Different login access for each type of user | B20: N
A21: Access via App for Staff and Webapp for Patrons | B21: N
A24: Note: Now process Functional requirements

Sheet: Initial
A1: Business Requirement (Functional Requirement) | B1: Importance Rating | D1: Ease of Realisation | E1: Final Rating
B2: Absolute | C2: Relative
B3: 17-1 | C3: 5-10 | D3: 5-10
A4: Search Book Title | B4: 17
A5: Reserve Book | B5: 16
A6: Checkout Book | B6: 15
A7: Checkin Book | B7: 14
A8: Add New Book | B8: 13
A9: Report Book Titles | B9: 12
A10: View Overdue Books | B10: 11
A11: Delete Book | B11: 10
A12: View Reservations | B12: 9
A13: Update Book Information | B13: 8
A14: Update Patron Information | B14: 7
A15: Update Reservation | B15: 6
A16: Print Loaned Book Report | B16: 5
A17: Remove Book From Library | B17: 4
A18: View Patron | B18: 3
A19: Remove Old Loans | B19: 2
A20: Remove Old Reservation | B20: 1
A22: Note: Now send to stakeholders for Relative rating

Sheet: Stage 1 
A1: Business Requirement (Functional Requirement) | B1: Importance Rating | D1: Ease of Realisation | E1: Final Rating
B2: Absolute | C2: Relative
B3: 17-1 | C3: 5-10 | D3: 5-10
A4: Search Book Title | B4: 17 | C4: 10
A5: Checkout Book | B5: 15 | C5: 10
A6: Checkin Book | B6: 14 | C6: 10
A7: Add New Book | B7: 13 | C7: 10
A8: View Patron | B8: 3 | C8: 9
A9: View Overdue Books | B9: 11 | C9: 8
A10: Reserve Book | B10: 16 | C10: 7
A11: View Reservations | B11: 9 | C11: 7
A12: Update Patron Information | B12: 7 | C12: 7
A13: Report Book Titles | B13: 12 | C13: 6
A14: Update Reservation | B14: 6 | C14: 6
A15: Print Loaned Book Report | B15: 5 | C15: 6
A16: Delete Book | B16: 10 | C16: 5
A17: Update Book Information | B17: 8 | C17: 5
A18: Remove Book From Library | B18: 4 | C18: 5
A19: Remove Old Loans | B19: 2 | C19: 5
A20: Remove Old Reservation | B20: 1 | C20: 5
A21: Note: Now sort on Relative then Absolute

Sheet: Stage 2
A1: Business Requirement (Functional Requirement) | B1: Importance Rating | D1: Ease of Realisation | E1: Final Rating
B2: Absolute | C2: Relative
B3: 17-1 | C3: 5-10 | D3: 5-10
A4: Search Book Title | B4: 17 | C4: 10 | D4: 10 | E4: =RC[-2]*RC[-1] -> 100 | F4: Straight read
A5: Add New Book | B5: 13 | C5: 10 | D5: 9 | E5: =RC[-2]*RC[-1] -> 90 | F5: straight read
A6: View Patron | B6: 3 | C6: 9 | D6: 10 | E6: =RC[-2]*RC[-1] -> 90 | F6: read 1 and create 1
A7: Checkin Book | B7: 14 | C7: 10 | D7: 8 | E7: =RC[-2]*RC[-1] -> 80
A8: Checkout Book | B8: 15 | C8: 10 | D8: 7 | E8: =RC[-2]*RC[-1] -> 70 | F8: read report
A9: View Overdue Books | B9: 11 | C9: 8 | D9: 8 | E9: =RC[-2]*RC[-1] -> 64
A10: Update Patron Information | B10: 7 | C10: 7 | D10: 9 | E10: =RC[-2]*RC[-1] -> 63 | F10: reads 5 and updates 2
A11: Reserve Book | B11: 16 | C11: 7 | D11: 8 | E11: =RC[-2]*RC[-1] -> 56 | F11: straight read of 3 then report
A12: View Reservations | B12: 9 | C12: 7 | D12: 8 | E12: =RC[-2]*RC[-1] -> 56 | F12: 1 create with 3 reads
A13: Report Book Titles | B13: 12 | C13: 6 | D13: 9 | E13: =RC[-2]*RC[-1] -> 54 | F13: read 3 with report
A14: Update Reservation | B14: 6 | C14: 6 | D14: 8 | E14: =RC[-2]*RC[-1] -> 48 | F14: read 3 update 1
A15: Update Book Information | B15: 8 | C15: 5 | D15: 9 | E15: =RC[-2]*RC[-1] -> 45 | F15: create 2 table entries and reads 3
A16: Print Loaned Book Report | B16: 5 | C16: 6 | D16: 7 | E16: =RC[-2]*RC[-1] -> 42 | F16: read 4 tables
A17: Delete Book | B17: 10 | C17: 5 | D17: 7 | E17: =RC[-2]*RC[-1] -> 35 | F17: delte, read book and current loans
A18: Remove Old Reservation | B18: 1 | C18: 5 | D18: 7 | E18: =RC[-2]*RC[-1] -> 35 | F18: read delete single
A19: Remove Book From Library | B19: 4 | C19: 5 | D19: 6 | E19: =RC[-2]*RC[-1] -> 30
A20: Remove Old Loans | B20: 2 | C20: 5 | D20: 6 | E20: =RC[-2]*RC[-1] -> 30
A21: Note: Now sort on Ease of realisation then Relative

Sheet: Stage 3
A1: Business Requirement (Functional Requirement) | B1: Importance Rating | D1: Ease of Realisation | E1: Final Rating
B2: Absolute | C2: Relative
A3: Mandatory items | B3: 17-1 | C3: 5-10 | D3: 5-10
A4: Search Book Title | B4: 17 | C4: 10 | D4: 10 | E4: =RC[-2]*RC[-1] -> 100
A5: Add New Book | B5: 13 | C5: 10 | D5: 9 | E5: =RC[-2]*RC[-1] -> 90
A6: View Patron | B6: 3 | C6: 9 | D6: 10 | E6: =RC[-2]*RC[-1] -> 90
A7: Checkin Book | B7: 14 | C7: 10 | D7: 8 | E7: =RC[-2]*RC[-1] -> 80
A8: Checkout Book | B8: 15 | C8: 10 | D8: 7 | E8: =RC[-2]*RC[-1] -> 70
A9: View Overdue Books | B9: 11 | C9: 8 | D9: 8 | E9: =RC[-2]*RC[-1] -> 64
A10: Update Patron Information | B10: 7 | C10: 7 | D10: 9 | E10: =RC[-2]*RC[-1] -> 63
A11: Reserve Book | B11: 16 | C11: 7 | D11: 8 | E11: =RC[-2]*RC[-1] -> 56
A12: View Reservations | B12: 9 | C12: 7 | D12: 8 | E12: =RC[-2]*RC[-1] -> 56
A13: Report Book Titles | B13: 12 | C13: 6 | D13: 9 | E13: =RC[-2]*RC[-1] -> 54
A18: Optional Items
A19: Update Reservation | B19: 6 | C19: 6 | D19: 8 | E19: =RC[-2]*RC[-1] -> 48
A20: Update Book Information | B20: 8 | C20: 5 | D20: 9 | E20: =RC[-2]*RC[-1] -> 45
A21: Print Loaned Book Report | B21: 5 | C21: 6 | D21: 7 | E21: =RC[-2]*RC[-1] -> 42
A22: Delete Book | B22: 10 | C22: 5 | D22: 7 | E22: =RC[-2]*RC[-1] -> 35
A23: Remove Old Reservation | B23: 1 | C23: 5 | D23: 7 | E23: =RC[-2]*RC[-1] -> 35
A24: Remove Book From Library | B24: 4 | C24: 5 | D24: 6 | E24: =RC[-2]*RC[-1] -> 30
A25: Remove Old Loans | B25: 2 | C25: 5 | D25: 6 | E25: =RC[-2]*RC[-1] -> 30
A26: Note: Sort on Final Rating then Relative

Sheet: Final
A1: Business Requirement (Functional Requirement) | B1: Final Rating
A3: Mandatory items
A4: Search Book Title | B4: 100
A5: Add New Book | B5: 90
A6: View Patron | B6: 90
A7: Checkin Book | B7: 80
A8: Checkout Book | B8: 70
A9: View Overdue Books | B9: 64
A10: Update Patron Information | B10: 63
A11: Reserve Book | B11: 56
A12: View Reservations | B12: 56
A13: Report Book Titles | B13: 54
A18: Optional Items
A19: Update Reservation | B19: 48
A20: Update Book Information | B20: 45
A21: Print Loaned Book Report | B21: 42
A22: Delete Book | B22: 35
A23: Remove Old Reservation | B23: 35
A24: Remove Book From Library | B24: 30
A25: Remove Old Loans | B25: 30
A27: Note: Sort on Final Rating then Relative